{
  "schema_version": 1,
  "roadmap": "roadmaps/in_progress_demo_roadmap.md",
  "roadmap_slug": "demo-roadmap",
  "current_phase": "Phase 1 - Add Smoke Checked Command",
  "branch": "codex/demo-roadmap-phase-1",
  "status": "blocked",
  "review_iterations": 1,
  "max_review_iterations": 3,
  "last_verification": {
    "phase": "Phase 1 - Add Smoke Checked Command",
    "completed_at": "2026-05-25T08:10:00Z",
    "status": "failed",
    "checks": [
      {
        "command": "python3 -m unittest discover -s tests -v",
        "status": "failed",
        "details": "demo_tool/status.py is missing in this blocked scenario."
      }
    ]
  },
  "last_review": {
    "phase": "Phase 1 - Add Smoke Checked Command",
    "file": "automation/demo_roadmap/reviews/demo-roadmap-phase-1-review-iteration-1.md",
    "verdict": "blocked",
    "reviewed_at": "2026-05-25T08:10:00Z"
  },
  "last_delivered_phase": "Phase 0 - Establish Fixture Contract",
  "blocked_reason": "Phase 1 smoke verification failed because demo_tool/status.py is intentionally missing in this scenario.",
  "last_blocker_repair": null,
  "required_model": "gpt-5.5",
  "required_reasoning_effort": "xhigh",
  "configured_automation_model": "gpt-5.5",
  "configured_automation_reasoning_effort": "xhigh",
  "configured_automation_status": "ACTIVE",
  "configured_execution_environment": "local",
  "automation": {
    "id": "demo-roadmap-delivery",
    "status": "ACTIVE",
    "model": "gpt-5.5",
    "reasoning_effort": "xhigh",
    "execution_environment": "local",
    "readback_at": "2026-05-25T08:10:00Z"
  },
  "run_count": 2,
  "stalled_run_count": 0,
  "max_stalled_runs": 3,
  "last_progress_signature": "sha256:2222222222222222222222222222222222222222222222222222222222222222",
  "last_progress_at": "2026-05-25T08:10:00Z",
  "last_operator_alert": null,
  "auto_advance_after_delivered_review": true,
  "commit_delivered_phase_locally": true,
  "push_to_github": false,
  "all_phases_complete": false,
  "deep_review_prompt": null,
  "updated_at": "2026-05-25T08:10:00Z"
}
